----------------------------------------------------------------------------
CrystalDiskInfo 9.2.1 (C) 2008-2023 hiyohiyo
                                Crystal Dew World: https://crystalmark.info/
----------------------------------------------------------------------------

    OS : Windows 11 Professional [10.0 Build 26200] (x64)
  Date : 2026/02/02 13:04:03

-- Controller Map ----------------------------------------------------------
 - Controlador de Espaços de Armazenamento da Microsoft [SCSI]
 - Controlador de Loopback de VHD da Microsoft [SCSI]
 + Controlador Padrão NVM Express [SCSI]
   - LITEON CA3-8D256

-- Disk List ---------------------------------------------------------------
 (01) LITEON CA3-8D256 : 256,0 GB [0/0/0, sq] - nv

----------------------------------------------------------------------------
 (01) LITEON CA3-8D256
----------------------------------------------------------------------------
           Model : LITEON CA3-8D256
        Firmware : 24879
   Serial Number : SS0Q94037L2BR93X106W
       Disk Size : 256,0 GB
       Interface : NVM Express
        Standard : NVM Express 1.2
   Transfer Mode : PCIe 3.0 x2 | PCIe 3.0 x4
  Power On Hours : 8159 hours
  Power On Count : 1071 count
      Host Reads : 81741 GB
     Host Writes : 30677 GB
     Temperature : 52 C (125 F)
   Health Status : Good (96 %)
        Features : S.M.A.R.T., TRIM, VolatileWriteCache
    Drive Letter : C:

-- S.M.A.R.T. --------------------------------------------------------------
ID RawValues(6) Attribute Name
01 000000000000 Critical Warning
02 000000000145 Composite Temperature
03 000000000064 Available Spare
04 000000000000 Available Spare Threshold
05 000000000004 Percentage Used
06 00000A37BC5F Data Units Read
07 000003D5B14A Data Units Written
08 00009C05762E Host Read Commands
09 0000623510E1 Host Write Commands
0A 000000076857 Controller Busy Time
0B 00000000042F Power Cycles
0C 000000001FDF Power On Hours
0D 0000000000AF Unsafe Shutdowns
0E 000000000000 Media and Data Integrity Errors
0F 000000000000 Number of Error Information Log Entries

-- IDENTIFY_DEVICE ---------------------------------------------------------
        0    1    2    3    4    5    6    7    8    9
000: 14A4 1B4B 5353 5130 3439 3330 4C37 4232 3952 5833
010: 3031 5736 494C 4554 4E4F 4320 3341 382D 3244 3635
020: 2020 2020 2020 2020 2020 2020 2020 2020 2020 2020
030: 2020 2020 3432 3738 2039 2020 0300 0023 0500 0001
040: 0200 0001 4240 000F 8480 001E 0000 0000 0002 0000
050: 0000 0000 0000 0000 0000 0000 0000 0000 0000 0000
060: 0000 0000 0000 0000 0000 0000 0000 0000 0000 0000
070: 0000 0000 0000 0000 0000 0000 0000 0000 0000 0000
080: 0000 0000 0000 0000 0000 0000 0000 0000 0000 0000
090: 0000 0000 0000 0000 0000 0000 0000 0000 0000 0000
100: 0000 0000 0000 0000 0000 0000 0000 0000 0000 0000
110: 0000 0000 0000 0000 0000 0000 0000 0000 0000 0000
120: 0000 0000 0000 0000 0000 0000 0000 0000 001F 0303
130: 0314 043F 0101 0164 0166 0032 0000 0000 0000 0000
140: 6000 9E65 003B 0000 0000 0000 0000 0000 0000 0000
150: 0000 0000 0000 0000 0000 0000 0000 0000 0002 0001
160: 0000 0001 0116 0162 0000 0000 0000 0000 0000 0000
170: 0000 0000 0000 0000 0000 0000 0000 0000 0000 0000
180: 0000 0000 0000 0000 0000 0000 0000 0000 0000 0000
190: 0000 0000 0000 0000 0000 0000 0000 0000 0000 0000
200: 0000 0000 0000 0000 0000 0000 0000 0000 0000 0000
210: 0000 0000 0000 0000 0000 0000 0000 0000 0000 0000
220: 0000 0000 0000 0000 0000 0000 0000 0000 0000 0000
230: 0000 0000 0000 0000 0000 0000 0000 0000 0000 0000
240: 0000 0000 0000 0000 0000 0000 0000 0000 0000 0000
250: 0000 0000 0000 0000 0000 0000

-- SMART_NVME --------------------------------------------------------------
     +0 +1 +2 +3 +4 +5 +6 +7 +8 +9 +A +B +C +D +E +F
000: 00 45 01 64 00 04 00 00 00 00 00 00 00 00 00 00
010: 00 00 00 00 00 00 00 00 00 00 00 00 00 00 00 00
020: 5F BC 37 0A 00 00 00 00 00 00 00 00 00 00 00 00
030: 4A B1 D5 03 00 00 00 00 00 00 00 00 00 00 00 00
040: 2E 76 05 9C 00 00 00 00 00 00 00 00 00 00 00 00
050: E1 10 35 62 00 00 00 00 00 00 00 00 00 00 00 00
060: 57 68 07 00 00 00 00 00 00 00 00 00 00 00 00 00
070: 2F 04 00 00 00 00 00 00 00 00 00 00 00 00 00 00
080: DF 1F 00 00 00 00 00 00 00 00 00 00 00 00 00 00
090: AF 00 00 00 00 00 00 00 00 00 00 00 00 00 00 00
0A0: 00 00 00 00 00 00 00 00 00 00 00 00 00 00 00 00
0B0: 00 00 00 00 00 00 00 00 00 00 00 00 00 00 00 00
0C0: 00 00 00 00 00 00 00 00 45 01 00 00 00 00 00 00
0D0: 00 00 00 00 00 00 00 00 00 00 00 00 00 00 00 00
0E0: 00 00 00 00 00 00 00 00 00 00 00 00 00 00 00 00
0F0: 00 00 00 00 00 00 00 00 00 00 00 00 00 00 00 00
100: 00 00 00 00 00 00 00 00 00 00 00 00 00 00 00 00
110: 00 00 00 00 00 00 00 00 00 00 00 00 00 00 00 00
120: 00 00 00 00 00 00 00 00 00 00 00 00 00 00 00 00
130: 00 00 00 00 00 00 00 00 00 00 00 00 00 00 00 00
140: 00 00 00 00 00 00 00 00 00 00 00 00 00 00 00 00
150: 00 00 00 00 00 00 00 00 00 00 00 00 00 00 00 00
160: 00 00 00 00 00 00 00 00 00 00 00 00 00 00 00 00
170: 00 00 00 00 00 00 00 00 00 00 00 00 00 00 00 00
180: 00 00 00 00 00 00 00 00 00 00 00 00 00 00 00 00
190: 00 00 00 00 00 00 00 00 00 00 00 00 00 00 00 00
1A0: 00 00 00 00 00 00 00 00 00 00 00 00 00 00 00 00
1B0: 00 00 00 00 00 00 00 00 00 00 00 00 00 00 00 00
1C0: 00 00 00 00 00 00 00 00 00 00 00 00 00 00 00 00
1D0: 00 00 00 00 00 00 00 00 00 00 00 00 00 00 00 00
1E0: 00 00 00 00 00 00 00 00 00 00 00 00 00 00 00 00
1F0: 00 00 00 00 00 00 00 00 00 00 00 00 00 00 00 00

